{
  "profile_id": "project05-action-ontology-v0.1-draft",
  "version": "0.1.0-draft",
  "status": "draft",
  "created_utc": "2026-07-18T00:00:00Z",
  "evidence_basis": {
    "construct_synthesis_ref": "04-progress/cost-action-construct-review-v0.1-20260718/construct-synthesis.md",
    "construct_synthesis_sha256": "091b6c59b83c6a7281406c23b5793ba51e23ee0701e6cd40072212a2e278eeb7"
  },
  "runtime_audit": {
    "current_executor_type": "outcome_reveal_simulator",
    "source_ref": "09-experiments/scripts/run_mvp.py::run_episode/recoverable_hidden/channel_is_up",
    "source_sha256": "a7ebcf2739b7cd708011db378d0f18af3eb970c6236813be7f8258d5394a952e",
    "execution_mechanism": "seeded_channel_availability_then_recoverable_hidden_claim_set_reveal",
    "external_collector_invoked": false,
    "operational_cost_measurement_eligible": false,
    "blocking_reason": "No real per-action collector or adapter currently executes the eight acquisition action types and emits unit-bearing resource telemetry."
  },
  "data_boundary": {
    "calibration_cases": [
      "C01-linux-provenance",
      "C02-freebsd-provenance",
      "C03-windows-host",
      "C04-darpa-e3-fivedirections",
      "C05-darpa-e3-cadets",
      "C06-darpa-e3-cadets-0412"
    ],
    "development_cases": [
      "C07-darpa-e5-theia-0515",
      "C08-darpa-e5-clearscope-0515",
      "C09-darpa-optc-sysclient0201-0923",
      "C10-darpa-optc-sysclient0351-0925",
      "C11-otrf-apt29-day1-scranton-nashua",
      "C12-witfoo-precinct6-f10c7270"
    ],
    "C13_plus": "sealed"
  },
  "scope": {
    "case_ids": [
      "C01-linux-provenance",
      "C02-freebsd-provenance",
      "C03-windows-host",
      "C04-darpa-e3-fivedirections",
      "C05-darpa-e3-cadets",
      "C06-darpa-e3-cadets-0412",
      "C07-darpa-e5-theia-0515",
      "C08-darpa-e5-clearscope-0515",
      "C09-darpa-optc-sysclient0201-0923",
      "C10-darpa-optc-sysclient0351-0925",
      "C11-otrf-apt29-day1-scranton-nashua",
      "C12-witfoo-precinct6-f10c7270"
    ],
    "action_count": 72,
    "legacy_case_files_mutated": false
  },
  "counting_semantics": {
    "status": "frozen_v0.1",
    "planner_decision_count": {
      "unit": "accepted_planner_output",
      "definition": "Count each planner output accepted at a decision boundary; a selected STOP is one planner decision.",
      "stop_counts_as_decision": true
    },
    "execution_attempt_count": {
      "unit": "executor_dispatch_attempt",
      "definition": "Count every dispatched acquisition execution separately, including failed, cancelled, and retried attempts.",
      "failures_count": true,
      "cancellations_count": true,
      "retries_are_new_attempts": true,
      "stop_counts_as_attempt": false
    },
    "primitive_operation_count": {
      "unit": "instrumented_low_level_operation",
      "definition": "Count operations at the collector-defined primitive boundary; never infer one primitive from one planner action.",
      "implicit_one_per_planner_action_forbidden": true
    },
    "split_merge_invariance": {
      "status": "required_before_formal_cost_claims",
      "rule": "Equivalent work must conserve raw resource totals when a planner action is split or merged; only the declared count level may change.",
      "required_tests": [
        "split_equivalent",
        "merge_equivalent",
        "retry_not_mergeable",
        "shared_overhead_conservation"
      ]
    }
  },
  "actions": [
    {
      "case_id": "C01-linux-provenance",
      "action_id": "C01-AA-001",
      "action_type": "extend_log_window",
      "phase": "calibration",
      "source_action_sha256": "5c2804f9183c345a1e8de4c7101174a3fcca5144145d40f32195ad9d60e8c463",
      "abstraction_level": "planner_evidence_acquisition_decision",
      "actor_and_authority": {
        "actor_role": null,
        "authority_boundary": null,
        "mapping_status": "unresolved"
      },
      "target": {
        "target_type": "time_window",
        "target_value": "2026-07-01T10:01:30Z/2026-07-01T10:03:00Z"
      },
      "preconditions": {
        "source_declared": [],
        "mapping_status": "unresolved"
      },
      "invocation": {
        "acquisition_channel": "log_retention",
        "natural_language_request": "Expand the Linux audit/provenance time window around the initial shell execution.",
        "machine_interface": null,
        "mapping_status": "unresolved"
      },
      "termination": {
        "success_criterion": null,
        "timeout_policy": null,
        "mapping_status": "unresolved"
      },
      "observation": {
        "declared_evidence_types": [
          "local_log",
          "provenance_graph"
        ],
        "observation_schema_ref": null,
        "mapping_status": "unresolved"
      },
      "state_effects": {
        "declared_expected_effect_fields": [
          "expected_conflict_resolution",
          "expected_coverage_delta",
          "expected_granularity_gain",
          "expected_over_attribution_risk_reduction",
          "expected_uncertainty_reduction"
        ],
        "realized_effect_source": "executor_observation_not_planner_prior",
        "mapping_status": "unresolved"
      },
      "execution_mapping": {
        "attempt_unit": "unresolved",
        "primitive_operation_boundary": "unresolved",
        "retry_policy": "unresolved",
        "shared_overhead_policy": "unresolved"
      }
    },
    {
      "case_id": "C01-linux-provenance",
      "action_id": "C01-AA-002",
      "action_type": "query_host_subgraph",
      "phase": "calibration",
      "source_action_sha256": "fee3db9a0d1d0b661c535e099d7b49a2e6fb170a6f2ff27b280c3e25a8d641dd",
      "abstraction_level": "planner_evidence_acquisition_decision",
      "actor_and_authority": {
        "actor_role": null,
        "authority_boundary": null,
        "mapping_status": "unresolved"
      },
      "target": {
        "target_type": "process",
        "target_value": "/tmp/.cache/upd"
      },
      "preconditions": {
        "source_declared": [],
        "mapping_status": "unresolved"
      },
      "invocation": {
        "acquisition_channel": "host_forensics",
        "natural_language_request": "Query the local provenance subgraph rooted at /tmp/.cache/upd.",
        "machine_interface": null,
        "mapping_status": "unresolved"
      },
      "termination": {
        "success_criterion": null,
        "timeout_policy": null,
        "mapping_status": "unresolved"
      },
      "observation": {
        "declared_evidence_types": [
          "provenance_graph",
          "malware_analysis"
        ],
        "observation_schema_ref": null,
        "mapping_status": "unresolved"
      },
      "state_effects": {
        "declared_expected_effect_fields": [
          "expected_conflict_resolution",
          "expected_coverage_delta",
          "expected_granularity_gain",
          "expected_over_attribution_risk_reduction",
          "expected_uncertainty_reduction"
        ],
        "realized_effect_source": "executor_observation_not_planner_prior",
        "mapping_status": "unresolved"
      },
      "execution_mapping": {
        "attempt_unit": "unresolved",
        "primitive_operation_boundary": "unresolved",
        "retry_policy": "unresolved",
        "shared_overhead_policy": "unresolved"
      }
    },
    {
      "case_id": "C01-linux-provenance",
      "action_id": "C01-AA-003",
      "action_type": "recover_network_summary",
      "phase": "calibration",
      "source_action_sha256": "2706465dc128fe570f4546af7575648e674323ee99fcf6f0554d347264fd888e",
      "abstraction_level": "planner_evidence_acquisition_decision",
      "actor_and_authority": {
        "actor_role": null,
        "authority_boundary": null,
        "mapping_status": "unresolved"
      },
      "target": {
        "target_type": "ip",
        "target_value": "198.51.100.77"
      },
      "preconditions": {
        "source_declared": [],
        "mapping_status": "unresolved"
      },
      "invocation": {
        "acquisition_channel": "network_telemetry",
        "natural_language_request": "Recover network flow summaries involving 198.51.100.77.",
        "machine_interface": null,
        "mapping_status": "unresolved"
      },
      "termination": {
        "success_criterion": null,
        "timeout_policy": null,
        "mapping_status": "unresolved"
      },
      "observation": {
        "declared_evidence_types": [
          "network_summary"
        ],
        "observation_schema_ref": null,
        "mapping_status": "unresolved"
      },
      "state_effects": {
        "declared_expected_effect_fields": [
          "expected_conflict_resolution",
          "expected_coverage_delta",
          "expected_granularity_gain",
          "expected_over_attribution_risk_reduction",
          "expected_uncertainty_reduction"
        ],
        "realized_effect_source": "executor_observation_not_planner_prior",
        "mapping_status": "unresolved"
      },
      "execution_mapping": {
        "attempt_unit": "unresolved",
        "primitive_operation_boundary": "unresolved",
        "retry_policy": "unresolved",
        "shared_overhead_policy": "unresolved"
      }
    },
    {
      "case_id": "C01-linux-provenance",
      "action_id": "C01-AA-004",
      "action_type": "ttp_local_probe",
      "phase": "calibration",
      "source_action_sha256": "280111eebfe2f66443bb92d9eab90d3d6167de627361344611b77a6692238492",
      "abstraction_level": "planner_evidence_acquisition_decision",
      "actor_and_authority": {
        "actor_role": null,
        "authority_boundary": null,
        "mapping_status": "unresolved"
      },
      "target": {
        "target_type": "technique",
        "target_value": "T1059"
      },
      "preconditions": {
        "source_declared": [],
        "mapping_status": "unresolved"
      },
      "invocation": {
        "acquisition_channel": "host_probe",